{
  "$schema": "http://json-schema.org/draft-07/schema#",
  "title": "MODA-design",
  "description": "A schema for MODA designs.",
  "type": "object",
  "properties": {
    "name": {
      "type": "string",
      "description": "The name of the model if provided by the user. If not provided, it will be auto-generated."
    },
    "moda-version": {
      "type": "string",
      "description": "version of moda. The moda version includes fabrication and hardware related constraints."
    },
    "author": {
      "type": "string",
      "description": "unique id for the user that created the design. If user did not login, this is blank"
    },
    "referrer-uri": {
      "type": "string",
      "description": "unique uri/url, capturing where the user came to the visualizer from"
    },
    "design-width-inches": {
      "type": "number",
      "description": "the design width, specified by the user in inches."
    },
    "design-height-inches": {
      "type": "number",
      "description": "the design height, specified by the user in inches."
    },
    "selected_pattern": {
      "type": "number",
      "description": "the selected pattern, as an integer to select from a list."
    },
    "selected_material": {
      "type": "number",
      "description": "the selected material, as an integer to select from a list."
    },
    "panels": {
      "type": "array",
      "description": "The panel elements of the model.",
      "items": {
        "type": "object",
        "properties": {
          "length": {
            "type": "number",
            "description": "The length identifier for the panel."
          },
          "transform": {
            "type": "object",
            "description": "The transformation matrix for the panel.",
            "properties": {
              "type": {
                "type": "string",
                "description": "The type of transformation (e.g., 'xform')."
              },
              "data": {
                "type": "array",
                "description": "4x4 transformation matrix data.",
                "items": {
                  "type": "array",
                  "items": {
                    "type": "number"
                  }
                }
              }
            },
            "required": ["type", "data"]
          },
          "material": {
            "type": "number",
            "description": "The material identifier for the panel."
          }
        },
        "required": [
          "length",
          "transform",
          "material"
        ]
      }
    }
  },
  "required": [
    "name",
    "author",
    "moda-version",
    "panels"
  ]
}