{
  "name": "Vertical Wall Display",
  "moda-version": "1.0",
  "author": "user-3",
  "referrer-uri": "https://example.com/gallery",
  "design-width-inches": 72,
  "design-height-inches": 96,
  "selected_pattern": 2,
  "selected_material": 1,
  "panels": [
    {
      "length": 0,
      "transform": {
        "type": "xform",
        "data": [
          [
            1.0,
            0.0,
            0.0,
            0.0
          ],
          [
            0.0,
            1.0,
            0.0,
            0.0
          ],
          [
            0.0,
            0.0,
            1.0,
            0.0
          ],
          [
            0.0,
            0.0,
            0.0,
            1.0
          ]
        ]
      },
      "material": 2
    },
    {
      "length": 1,
      "transform": {
        "type": "xform",
        "data": [
          [
            1.0,
            0.0,
            0.0,
            0.0
          ],
          [
            0.0,
            1.0,
            0.0,
            0.0
          ],
          [
            0.0,
            0.0,
            1.0,
            0.0
          ],
          [
            36.0,
            0.0,
            0.0,
            1.0
          ]
        ]
      },
      "material": 3
    },
    {
      "length": 0,
      "transform": {
        "type": "xform",
        "data": [
          [
            1.0,
            0.0,
            0.0,
            0.0
          ],
          [
            0.0,
            1.0,
            0.0,
            0.0
          ],
          [
            0.0,
            0.0,
            1.0,
            0.0
          ],
          [
            0.0,
            0.0,
            24.0,
            1.0
          ]
        ]
      },
      "material": 2
    },
    {
      "length": 1,
      "transform": {
        "type": "xform",
        "data": [
          [
            1.0,
            0.0,
            0.0,
            0.0
          ],
          [
            0.0,
            1.0,
            0.0,
            0.0
          ],
          [
            0.0,
            0.0,
            1.0,
            0.0
          ],
          [
            36.0,
            0.0,
            24.0,
            1.0
          ]
        ]
      },
      "material": 3
    },
    {
      "length": 0,
      "transform": {
        "type": "xform",
        "data": [
          [
            1.0,
            0.0,
            0.0,
            0.0
          ],
          [
            0.0,
            1.0,
            0.0,
            0.0
          ],
          [
            0.0,
            0.0,
            1.0,
            0.0
          ],
          [
            0.0,
            0.0,
            48.0,
            1.0
          ]
        ]
      },
      "material": 2
    },
    {
      "length": 1,
      "transform": {
        "type": "xform",
        "data": [
          [
            1.0,
            0.0,
            0.0,
            0.0
          ],
          [
            0.0,
            1.0,
            0.0,
            0.0
          ],
          [
            0.0,
            0.0,
            1.0,
            0.0
          ],
          [
            36.0,
            0.0,
            48.0,
            1.0
          ]
        ]
      },
      "material": 3
    },
    {
      "length": 0,
      "transform": {
        "type": "xform",
        "data": [
          [
            1.0,
            0.0,
            0.0,
            0.0
          ],
          [
            0.0,
            1.0,
            0.0,
            0.0
          ],
          [
            0.0,
            0.0,
            1.0,
            0.0
          ],
          [
            0.0,
            0.0,
            72.0,
            1.0
          ]
        ]
      },
      "material": 2
    },
    {
      "length": 1,
      "transform": {
        "type": "xform",
        "data": [
          [
            1.0,
            0.0,
            0.0,
            0.0
          ],
          [
            0.0,
            1.0,
            0.0,
            0.0
          ],
          [
            0.0,
            0.0,
            1.0,
            0.0
          ],
          [
            36.0,
            0.0,
            72.0,
            1.0
          ]
        ]
      },
      "material": 3
    }
  ]
}
