{
  "name": "Sample Design 2",
  "moda-version": "1.0",
  "author": "user-2",
  "referrer-uri": "https://example.com/visualizer",
  "design-width-inches": 108,
  "design-height-inches": 72,
  "selected_pattern": 1,
  "selected_material": 1,
  "panels": [
    {
      "length": 0,
      "transform": {
        "type": "xform",
        "data": [
          [
            0.0,
            0.0,
            1.0,
            0.0
          ],
          [
            -1.0,
            0.0,
            0.0,
            0.0
          ],
          [
            0.0,
            -1.0,
            0.0,
            0.0
          ],
          [
            -28.375000000000007,
            0.0,
            8.875,
            1.0
          ]
        ]
      },
      "material": 0
    },
    {
      "length": 1,
      "transform": {
        "type": "xform",
        "data": [
          [
            0.0,
            0.0,
            1.0,
            0.0
          ],
          [
            -1.0,
            0.0,
            0.0,
            0.0
          ],
          [
            0.0,
            -1.0,
            0.0,
            0.0
          ],
          [
            19.374999999999993,
            0.0,
            8.875,
            1.0
          ]
        ]
      },
      "material": 1
    },
    {
      "length": 0,
      "transform": {
        "type": "xform",
        "data": [
          [
            0.0,
            0.0,
            1.0,
            0.0
          ],
          [
            -1.0,
            0.0,
            0.0,
            0.0
          ],
          [
            0.0,
            -1.0,
            0.0,
            0.0
          ],
          [
            -28.375000000000007,
            0.0,
            29.4375,
            1.0
          ]
        ]
      },
      "material": 0
    },
    {
      "length": 1,
      "transform": {
        "type": "xform",
        "data": [
          [
            0.0,
            0.0,
            1.0,
            0.0
          ],
          [
            -1.0,
            0.0,
            0.0,
            0.0
          ],
          [
            0.0,
            -1.0,
            0.0,
            0.0
          ],
          [
            19.374999999999993,
            0.0,
            29.4375,
            1.0
          ]
        ]
      },
      "material": 1
    },
    {
      "length": 0,
      "transform": {
        "type": "xform",
        "data": [
          [
            0.0,
            0.0,
            1.0,
            0.0
          ],
          [
            -1.0,
            0.0,
            0.0,
            0.0
          ],
          [
            0.0,
            -1.0,
            0.0,
            0.0
          ],
          [
            -28.375000000000007,
            0.0,
            50.0,
            1.0
          ]
        ]
      },
      "material": 0
    },
    {
      "length": 1,
      "transform": {
        "type": "xform",
        "data": [
          [
            0.0,
            0.0,
            1.0,
            0.0
          ],
          [
            -1.0,
            0.0,
            0.0,
            0.0
          ],
          [
            0.0,
            -1.0,
            0.0,
            0.0
          ],
          [
            19.374999999999993,
            0.0,
            50.0,
            1.0
          ]
        ]
      },
      "material": 1
    },
    {
      "length": 0,
      "transform": {
        "type": "xform",
        "data": [
          [
            0.0,
            0.0,
            1.0,
            0.0
          ],
          [
            -1.0,
            0.0,
            0.0,
            0.0
          ],
          [
            0.0,
            -1.0,
            0.0,
            0.0
          ],
          [
            -28.375000000000007,
            0.0,
            70.5625,
            1.0
          ]
        ]
      },
      "material": 0
    },
    {
      "length": 1,
      "transform": {
        "type": "xform",
        "data": [
          [
            0.0,
            0.0,
            1.0,
            0.0
          ],
          [
            -1.0,
            0.0,
            0.0,
            0.0
          ],
          [
            0.0,
            -1.0,
            0.0,
            0.0
          ],
          [
            19.374999999999993,
            0.0,
            70.5625,
            1.0
          ]
        ]
      },
      "material": 1
    },
    {
      "length": 0,
      "transform": {
        "type": "xform",
        "data": [
          [
            0.0,
            0.0,
            1.0,
            0.0
          ],
          [
            -1.0,
            0.0,
            0.0,
            0.0
          ],
          [
            0.0,
            -1.0,
            0.0,
            0.0
          ],
          [
            -28.375000000000007,
            0.0,
            91.125,
            1.0
          ]
        ]
      },
      "material": 0
    },
    {
      "length": 1,
      "transform": {
        "type": "xform",
        "data": [
          [
            0.0,
            0.0,
            1.0,
            0.0
          ],
          [
            -1.0,
            0.0,
            0.0,
            0.0
          ],
          [
            0.0,
            -1.0,
            0.0,
            0.0
          ],
          [
            19.374999999999993,
            0.0,
            91.125,
            1.0
          ]
        ]
      },
      "material": 1
    }
  ]
}
