{
  "name": "Compact Square Layout",
  "moda-version": "1.0",
  "author": "user-5",
  "referrer-uri": "https://example.com/designer",
  "design-width-inches": 54,
  "design-height-inches": 54,
  "selected_pattern": 3,
  "selected_material": 1,
  "panels": [
    {
      "length": 2,
      "transform": {
        "type": "xform",
        "data": [
          [
            0.707,
            -0.707,
            0.0,
            0.0
          ],
          [
            0.707,
            0.707,
            0.0,
            0.0
          ],
          [
            0.0,
            0.0,
            1.0,
            0.0
          ],
          [
            13.5,
            13.5,
            0.0,
            1.0
          ]
        ]
      },
      "material": 4
    },
    {
      "length": 2,
      "transform": {
        "type": "xform",
        "data": [
          [
            0.707,
            -0.707,
            0.0,
            0.0
          ],
          [
            0.707,
            0.707,
            0.0,
            0.0
          ],
          [
            0.0,
            0.0,
            1.0,
            0.0
          ],
          [
            40.5,
            13.5,
            0.0,
            1.0
          ]
        ]
      },
      "material": 5
    },
    {
      "length": 2,
      "transform": {
        "type": "xform",
        "data": [
          [
            0.707,
            -0.707,
            0.0,
            0.0
          ],
          [
            0.707,
            0.707,
            0.0,
            0.0
          ],
          [
            0.0,
            0.0,
            1.0,
            0.0
          ],
          [
            13.5,
            40.5,
            0.0,
            1.0
          ]
        ]
      },
      "material": 5
    },
    {
      "length": 2,
      "transform": {
        "type": "xform",
        "data": [
          [
            0.707,
            -0.707,
            0.0,
            0.0
          ],
          [
            0.707,
            0.707,
            0.0,
            0.0
          ],
          [
            0.0,
            0.0,
            1.0,
            0.0
          ],
          [
            40.5,
            40.5,
            0.0,
            1.0
          ]
        ]
      },
      "material": 4
    }
  ]
}
